{"_D":"urn:oasis:names:specification:ubl:schema:xsd:DigitalAgreement-2",
 "_A":"urn:oasis:names:specification:ubl:schema:xsd:CommonAggregateComponents-2",
 "_B":"urn:oasis:names:specification:ubl:schema:xsd:CommonBasicComponents-2",
 "DigitalAgreement":[{
 "UBLVersionID":[{"_":"2.2"}],
 "ID":[{"_":"A12345-2016"}],
 "IssueDate":[{"_":"2016-11-07"}],
 "AgreementTypeCode":[{"_":"Bilateral"}],
 "VersionID":[{"_":"1.1"}],
 "PreviousVersionID":[{"_":"1.0"}],
 "ParticipantParty":[{
  "InitiatingPartyIndicator":[{"_":true}],
  "PrivatePartyIndicator":[{"_":true}],
  "Party":[{
   "EndpointID":[{"_":"1234567987654",
    "schemeAgencyID":"9",
    "schemeID":"GLN"}],
   "PartyName":[{
    "Name":[{"_":"Vendor Inc."}]
   }],
   "PostalAddress":[{
    "CityName":[{"_":"New York"}],
    "Country":[{
     "IdentificationCode":[{"_":"US"}]
    }]
   }]
  }],
  "LegalContact":[{
   "Name":[{"_":"John Smith"}],
   "ElectronicMail":[{"_":"john.smith@vendor.net"}]
  }],
  "TechnicalContact":[{
   "Name":[{"_":"Paul McQueen"}],
   "ElectronicMail":[{"_":"paul.mcqueen@vendor.net"}]
  }],
  "SupportContact":[{
   "Name":[{"_":"Paul McQueen"}],
   "ElectronicMail":[{"_":"paul.mcqueen@vendor.net"}]
  }],
  "CommercialContact":[{
   "Name":[{"_":"Jennifer de Niro"}],
   "ElectronicMail":[{"_":"jennifer.deniro@vendor.net"}]
  }]
 },{
  "PrivatePartyIndicator":[{"_":true}],
  "Party":[{
   "EndpointID":[{"_":"9994567987654",
    "schemeAgencyID":"9",
    "schemeID":"GLN"}],
   "PartyName":[{
    "Name":[{"_":"Buyer GmbH"}]
   }],
   "PostalAddress":[{
    "CityName":[{"_":"Munchen"}],
    "Country":[{
     "IdentificationCode":[{"_":"DE"}]
    }]
   }]
  }],
  "LegalContact":[{
   "Name":[{"_":"Peter Gruen"}],
   "ElectronicMail":[{"_":"peter.gruen@buyer.de"}]
  }],
  "TechnicalContact":[{
   "Name":[{"_":"Peter Gruen"}],
   "ElectronicMail":[{"_":"peter.gruen@buyer.de"}]
  }],
  "SupportContact":[{
   "Name":[{"_":"Peter Gruen"}],
   "ElectronicMail":[{"_":"peter.gruen@buyer.de"}]
  }],
  "CommercialContact":[{
   "Name":[{"_":"Peter Gruen"}],
   "ElectronicMail":[{"_":"peter.gruen@buyer.de"}]
  }]
 }],
 "AgreementCountry":[{
  "IdentificationCode":[{"_":"US"}]
 },{
  "IdentificationCode":[{"_":"DE"}]
 },{
  "IdentificationCode":[{"_":"GB"}]
 },{
  "IdentificationCode":[{"_":"DK"}]
 }],
 "DigitalAgreementTerms":[{
  "Description":[{"_":"Trading Partner Agreement Terms"}],
  "AdoptionPeriod":[{
   "DurationMeasure":[{"_":90,
    "unitCode":"DAY"}]
  }],
  "ServiceLevelAgreement":[{
   "ID":[{"_":"1"}],
   "ServiceTypeCode":[{"_":"AP"}],
   "AvailabilityTimePercent":[{"_":98.5}],
   "MondayAvailabilityIndicator":[{"_":true}],
   "TuesdayAvailabilityIndicator":[{"_":true}],
   "WednesdayAvailabilityIndicator":[{"_":true}],
   "ThursdayAvailabilityIndicator":[{"_":true}],
   "FridayAvailabilityIndicator":[{"_":true}],
   "MinimumResponseTimeDurationMeasure":[{"_":300,
    "unitCode":"SEC"}],
   "MinimumDownTimeScheduleDurationMeasure":[{"_":3,
    "unitCode":"DAY"}],
   "MaximumIncidentNotificationDurationMeasure":[{"_":4,
    "unitCode":"HUR"}],
   "MaximumDataLossDurationMeasure":[{"_":24,
    "unitCode":"HUR"}],
   "MeanTimeToRecoverDurationMeasure":[{"_":3,
    "unitCode":"HUR"}],
   "ServiceAvailabilityPeriod":[{
    "StartTime":[{"_":"09:00:00Z"}],
    "EndTime":[{"_":"16:00:00Z"}]
   }],
   "ServiceMaintenancePeriod":[{
    "StartTime":[{"_":"22:00:00Z"}],
    "EndTime":[{"_":"06:00:00Z"}]
   }]
  },{
   "ID":[{"_":"2"}],
   "ServiceTypeCode":[{"_":"AP"}],
   "AvailabilityTimePercent":[{"_":94.0}],
   "SaturdayAvailabilityIndicator":[{"_":true}],
   "SundayAvailabilityIndicator":[{"_":true}],
   "ServiceAvailabilityPeriod":[{
    "StartTime":[{"_":"09:00:00Z"}],
    "EndTime":[{"_":"16:00:00Z"}]
   }],
   "ServiceMaintenancePeriod":[{
    "StartTime":[{"_":"22:00:00Z"}],
    "EndTime":[{"_":"06:00:00Z"}]
   }]
  }]
 }],
 "DigitalProcess":[{
  "ID":[{"_":"1"}],
  "ProfileID":[{"_":"urn:www.cenbii.eu:profile:bii05:ver2.0"}],
  "DigitalCollaboration":[{
   "ID":[{"_":"1"}],
   "SendingDigitalService":[{
    "ID":[{"_":"Invoice"}],
    "CustomizationID":[{"_":"urn:www.cenbii.eu:transaction:biitrns010:ver2.0:extended:urn:www.peppol.eu:bis:peppol5a:ver2.0"}],
    "DigitalDocumentMetadata":[{
     "FormatID":[{"_":"UBL"}],
     "VersionID":[{"_":"2.2"}],
     "SchemaURI":[{"_":"urn:oasis:names:specification:ubl:schema:xsd:Invoice-2"}],
     "DocumentTypeCode":[{"_":"380",
      "listAgencyID":"6",
      "listID":"UN/ECE 1001"}]
    }],
    "DigitalDeliveryChannel":[{
     "NetworkID":[{"_":"OpenPEPPOL"}],
     "ParticipantID":[{"_":"1234567987654",
      "schemeAgencyID":"9",
      "schemeID":"GLN"}],
     "TestIndicator":[{"_":true}],
     "DigitalMessageDelivery":[{
      "ProtocolID":[{"_":"AS2"}],
      "EndpointURI":[{"_":"http://as2.buyer.de"}]
     }]
    }]
   }],
   "ReceivingDigitalService":[{
    "ID":[{"_":"CreditNote"}],
    "CustomizationID":[{"_":"urn:www.cenbii.eu:transaction:biitrns014:ver2.0:extended:urn:www.peppol.eu:bis:peppol5a:ver2.0"}],
    "DigitalDocumentMetadata":[{
     "FormatID":[{"_":"UBL"}],
     "VersionID":[{"_":"2.2"}],
     "SchemaURI":[{"_":"urn:oasis:names:specification:ubl:schema:xsd:CreditNote-2"}],
     "DocumentTypeCode":[{"_":"381",
      "listAgencyID":"6",
      "listID":"UN/ECE 1001"}]
    }],
    "DigitalDeliveryChannel":[{
     "NetworkID":[{"_":"OpenPEPPOL"}],
     "ParticipantID":[{"_":"1234567987654",
      "schemeAgencyID":"9",
      "schemeID":"GLN"}],
     "DigitalMessageDelivery":[{
      "ProtocolID":[{"_":"AS2"}],
      "EndpointURI":[{"_":"http://as2.vendor.biz"}]
     }]
    }]
   }]
  }]
 }]
}]}